[
  {
    "thesis_id": "s04e01-uss-callister-dna-derived-digital-clone-vr",
    "as_of": "2026-07-09",
    "provenance": "deepresearch-agent",
    "axes": {
      "THESIS_POSS": {
        "value": 12.0,
        "ci_low": 4.0,
        "ci_high": 20.0,
        "tier": "L2"
      },
      "AI_EXEC": {
        "value": 30.0,
        "ci_low": 18.0,
        "ci_high": 42.0,
        "tier": "L2"
      },
      "TRL_comp": {
        "value": 15.0,
        "ci_low": 5.0,
        "ci_high": 25.0,
        "tier": "L2"
      },
      "SYS": {
        "value": 10.0,
        "ci_low": 2.0,
        "ci_high": 18.0,
        "tier": "L2"
      },
      "ECON": {
        "value": 20.0,
        "ci_low": 8.0,
        "ci_high": 32.0,
        "tier": "L1"
      },
      "SOC": {
        "value": 15.0,
        "ci_low": 5.0,
        "ci_high": 25.0,
        "tier": "L1"
      },
      "FID": {
        "value": 15.0,
        "ci_low": 5.0,
        "ci_high": 25.0,
        "tier": "L2"
      }
    },
    "contested": false,
    "contested_notes": "",
    "rationale_short": "DNA\u2192full mind is sci-fi. Harassment via digital likeness is nearer but different thesis.",
    "nearest_real_systems": [
      "VR games with AI NPCs",
      "deepfake coworkers",
      "not DNA consciousness"
    ],
    "evidence_ids": [
      "s04e01-uss-callister-dna-derived-digital-clone-vr-ev1"
    ]
  },
  {
    "thesis_id": "s04e01-uss-callister-likeness-abuse-in-private-sim",
    "as_of": "2026-07-09",
    "provenance": "deepresearch-agent",
    "axes": {
      "THESIS_POSS": {
        "value": 70.0,
        "ci_low": 58.0,
        "ci_high": 82.0,
        "tier": "L2"
      },
      "AI_EXEC": {
        "value": 80.0,
        "ci_low": 70.0,
        "ci_high": 90.0,
        "tier": "L2"
      },
      "TRL_comp": {
        "value": 85.0,
        "ci_low": 77.0,
        "ci_high": 93.0,
        "tier": "L2"
      },
      "SYS": {
        "value": 65.0,
        "ci_low": 53.0,
        "ci_high": 77.0,
        "tier": "L2"
      },
      "ECON": {
        "value": 75.0,
        "ci_low": 65.0,
        "ci_high": 85.0,
        "tier": "L2"
      },
      "SOC": {
        "value": 40.0,
        "ci_low": 25.0,
        "ci_high": 55.0,
        "tier": "L2"
      },
      "FID": {
        "value": 55.0,
        "ci_low": 43.0,
        "ci_high": 67.0,
        "tier": "L2"
      }
    },
    "contested": false,
    "contested_notes": "",
    "rationale_short": "High AI_EXEC for likeness abuse; full conscious crew is not required for substantial harm.",
    "nearest_real_systems": [
      "non-consensual deepfakes",
      "AI companions with celebrity likeness"
    ],
    "evidence_ids": [
      "s04e01-uss-callister-likeness-abuse-in-private-sim-ev1"
    ]
  },
  {
    "thesis_id": "s04e01-uss-callister-partial-real-world-analogue",
    "as_of": "2026-07-09",
    "provenance": "deepresearch-agent",
    "axes": {
      "THESIS_POSS": {
        "value": 13.799999999999999,
        "ci_low": 1.799999999999999,
        "ci_high": 25.799999999999997,
        "tier": "L1"
      },
      "AI_EXEC": {
        "value": 34.5,
        "ci_low": 18.5,
        "ci_high": 50.5,
        "tier": "L1"
      },
      "TRL_comp": {
        "value": 17.25,
        "ci_low": 3.25,
        "ci_high": 31.25,
        "tier": "L1"
      },
      "SYS": {
        "value": 11.5,
        "ci_low": 0.0,
        "ci_high": 23.5,
        "tier": "L1"
      },
      "ECON": {
        "value": 23.0,
        "ci_low": 7.0,
        "ci_high": 39.0,
        "tier": "L1"
      },
      "SOC": {
        "value": 17.25,
        "ci_low": 3.25,
        "ci_high": 31.25,
        "tier": "L1"
      },
      "FID": {
        "value": 17.25,
        "ci_low": 3.25,
        "ci_high": 31.25,
        "tier": "L1"
      }
    },
    "contested": false,
    "contested_notes": "",
    "rationale_short": "Partial-analogue card: scores emphasize systems that capture some mechanisms without claiming full episode outcome fidelity. DNA\u2192full mind is sci-fi. Harassment via digital likeness is nearer but different thesis.",
    "nearest_real_systems": [
      "VR games with AI NPCs",
      "deepfake coworkers",
      "not DNA consciousness",
      "partial market analogues"
    ],
    "evidence_ids": [
      "s04e01-uss-callister-partial-real-world-analogue-ev1"
    ]
  }
]
