[
  {
    "thesis_id": "s07e05-eulogy-step-into-photograph-memory",
    "as_of": "2026-07-09",
    "provenance": "deepresearch-agent",
    "axes": {
      "THESIS_POSS": {
        "value": 55.0,
        "ci_low": 40.0,
        "ci_high": 70.0,
        "tier": "L2"
      },
      "AI_EXEC": {
        "value": 70.0,
        "ci_low": 58.0,
        "ci_high": 82.0,
        "tier": "L2"
      },
      "TRL_comp": {
        "value": 65.0,
        "ci_low": 53.0,
        "ci_high": 77.0,
        "tier": "L2"
      },
      "SYS": {
        "value": 40.0,
        "ci_low": 25.0,
        "ci_high": 55.0,
        "tier": "L1"
      },
      "ECON": {
        "value": 55.0,
        "ci_low": 40.0,
        "ci_high": 70.0,
        "tier": "L1"
      },
      "SOC": {
        "value": 70.0,
        "ci_low": 58.0,
        "ci_high": 82.0,
        "tier": "L1"
      },
      "FID": {
        "value": 40.0,
        "ci_low": 25.0,
        "ci_high": 55.0,
        "tier": "L1"
      }
    },
    "contested": false,
    "contested_notes": "",
    "rationale_short": "Image-to-3D is advancing quickly; full emotional 'step inside' product is emerging but not episode-complete.",
    "nearest_real_systems": [
      "NeRF/3D Gaussian reconstruction",
      "AI photo animation",
      "VR memory projects"
    ],
    "evidence_ids": [
      "s07e05-eulogy-step-into-photograph-memory-ev1"
    ]
  },
  {
    "thesis_id": "s07e05-eulogy-partial-real-world-analogue",
    "as_of": "2026-07-09",
    "provenance": "deepresearch-agent",
    "axes": {
      "THESIS_POSS": {
        "value": 63.24999999999999,
        "ci_low": 44.24999999999999,
        "ci_high": 82.25,
        "tier": "L1"
      },
      "AI_EXEC": {
        "value": 80.5,
        "ci_low": 64.5,
        "ci_high": 96.5,
        "tier": "L1"
      },
      "TRL_comp": {
        "value": 74.75,
        "ci_low": 58.75,
        "ci_high": 90.75,
        "tier": "L1"
      },
      "SYS": {
        "value": 46.0,
        "ci_low": 27.0,
        "ci_high": 65.0,
        "tier": "L1"
      },
      "ECON": {
        "value": 63.24999999999999,
        "ci_low": 44.24999999999999,
        "ci_high": 82.25,
        "tier": "L1"
      },
      "SOC": {
        "value": 80.5,
        "ci_low": 64.5,
        "ci_high": 96.5,
        "tier": "L1"
      },
      "FID": {
        "value": 46.0,
        "ci_low": 27.0,
        "ci_high": 65.0,
        "tier": "L1"
      }
    },
    "contested": false,
    "contested_notes": "",
    "rationale_short": "Partial-analogue card: scores emphasize systems that capture some mechanisms without claiming full episode outcome fidelity. Image-to-3D is advancing quickly; full emotional 'step inside' product is emerging but not episode-complete.",
    "nearest_real_systems": [
      "NeRF/3D Gaussian reconstruction",
      "AI photo animation",
      "VR memory projects",
      "partial market analogues"
    ],
    "evidence_ids": [
      "s07e05-eulogy-partial-real-world-analogue-ev1"
    ]
  },
  {
    "thesis_id": "s07e05-eulogy-full-fidelity-gap",
    "as_of": "2026-07-09",
    "provenance": "deepresearch-agent",
    "axes": {
      "THESIS_POSS": {
        "value": 35.75,
        "ci_low": 16.75,
        "ci_high": 54.75,
        "tier": "L1"
      },
      "AI_EXEC": {
        "value": 45.5,
        "ci_low": 29.5,
        "ci_high": 61.5,
        "tier": "L1"
      },
      "TRL_comp": {
        "value": 42.25,
        "ci_low": 26.25,
        "ci_high": 58.25,
        "tier": "L1"
      },
      "SYS": {
        "value": 26.0,
        "ci_low": 7.0,
        "ci_high": 45.0,
        "tier": "L1"
      },
      "ECON": {
        "value": 35.75,
        "ci_low": 16.75,
        "ci_high": 54.75,
        "tier": "L1"
      },
      "SOC": {
        "value": 45.5,
        "ci_low": 29.5,
        "ci_high": 61.5,
        "tier": "L1"
      },
      "FID": {
        "value": 26.0,
        "ci_low": 7.0,
        "ci_high": 45.0,
        "tier": "L1"
      }
    },
    "contested": false,
    "contested_notes": "",
    "rationale_short": "Full-fidelity gap card: intentionally stricter than component readiness. Punishes collapsing gadget demos into episode-complete systems. Image-to-3D is advancing quickly; full emotional 'step inside' product is emerging but not episode-complete.",
    "nearest_real_systems": [
      "NeRF/3D Gaussian reconstruction",
      "AI photo animation",
      "VR memory projects"
    ],
    "evidence_ids": [
      "s07e05-eulogy-full-fidelity-gap-ev1"
    ]
  }
]
