[
  {
    "thesis_id": "s05e02-smithereens-platform-addiction-hostage",
    "as_of": "2026-07-09",
    "provenance": "deepresearch-agent",
    "axes": {
      "THESIS_POSS": {
        "value": 85.0,
        "ci_low": 77.0,
        "ci_high": 93.0,
        "tier": "L3"
      },
      "AI_EXEC": {
        "value": 88.0,
        "ci_low": 82.0,
        "ci_high": 94.0,
        "tier": "L3"
      },
      "TRL_comp": {
        "value": 95.0,
        "ci_low": 90.0,
        "ci_high": 100.0,
        "tier": "L3"
      },
      "SYS": {
        "value": 90.0,
        "ci_low": 85.0,
        "ci_high": 95.0,
        "tier": "L3"
      },
      "ECON": {
        "value": 95.0,
        "ci_low": 90.0,
        "ci_high": 100.0,
        "tier": "L3"
      },
      "SOC": {
        "value": 50.0,
        "ci_low": 35.0,
        "ci_high": 65.0,
        "tier": "L2"
      },
      "FID": {
        "value": 80.0,
        "ci_low": 70.0,
        "ci_high": 90.0,
        "tier": "L2"
      }
    },
    "contested": false,
    "contested_notes": "",
    "rationale_short": "Among highest FID episodes to 2026 reality.",
    "nearest_real_systems": [
      "major social platforms",
      "attention economy regulation debates"
    ],
    "evidence_ids": [
      "s05e02-smithereens-platform-addiction-hostage-ev1"
    ]
  },
  {
    "thesis_id": "s05e02-smithereens-partial-real-world-analogue",
    "as_of": "2026-07-09",
    "provenance": "deepresearch-agent",
    "axes": {
      "THESIS_POSS": {
        "value": 97.74999999999999,
        "ci_low": 85.74999999999999,
        "ci_high": 100.0,
        "tier": "L1"
      },
      "AI_EXEC": {
        "value": 100.0,
        "ci_low": 90.0,
        "ci_high": 100.0,
        "tier": "L1"
      },
      "TRL_comp": {
        "value": 100.0,
        "ci_low": 91.0,
        "ci_high": 100.0,
        "tier": "L1"
      },
      "SYS": {
        "value": 100.0,
        "ci_low": 91.0,
        "ci_high": 100.0,
        "tier": "L1"
      },
      "ECON": {
        "value": 100.0,
        "ci_low": 91.0,
        "ci_high": 100.0,
        "tier": "L1"
      },
      "SOC": {
        "value": 57.49999999999999,
        "ci_low": 38.49999999999999,
        "ci_high": 76.5,
        "tier": "L1"
      },
      "FID": {
        "value": 92.0,
        "ci_low": 78.0,
        "ci_high": 100.0,
        "tier": "L1"
      }
    },
    "contested": false,
    "contested_notes": "",
    "rationale_short": "Partial-analogue card: scores emphasize systems that capture some mechanisms without claiming full episode outcome fidelity. Among highest FID episodes to 2026 reality.",
    "nearest_real_systems": [
      "major social platforms",
      "attention economy regulation debates",
      "partial market analogues"
    ],
    "evidence_ids": [
      "s05e02-smithereens-partial-real-world-analogue-ev1"
    ]
  },
  {
    "thesis_id": "s05e02-smithereens-full-fidelity-gap",
    "as_of": "2026-07-09",
    "provenance": "deepresearch-agent",
    "axes": {
      "THESIS_POSS": {
        "value": 55.25,
        "ci_low": 43.25,
        "ci_high": 67.25,
        "tier": "L1"
      },
      "AI_EXEC": {
        "value": 57.2,
        "ci_low": 47.2,
        "ci_high": 67.2,
        "tier": "L1"
      },
      "TRL_comp": {
        "value": 61.75,
        "ci_low": 52.75,
        "ci_high": 70.75,
        "tier": "L1"
      },
      "SYS": {
        "value": 58.5,
        "ci_low": 49.5,
        "ci_high": 67.5,
        "tier": "L1"
      },
      "ECON": {
        "value": 61.75,
        "ci_low": 52.75,
        "ci_high": 70.75,
        "tier": "L1"
      },
      "SOC": {
        "value": 32.5,
        "ci_low": 13.5,
        "ci_high": 51.5,
        "tier": "L1"
      },
      "FID": {
        "value": 52.0,
        "ci_low": 38.0,
        "ci_high": 66.0,
        "tier": "L1"
      }
    },
    "contested": false,
    "contested_notes": "",
    "rationale_short": "Full-fidelity gap card: intentionally stricter than component readiness. Punishes collapsing gadget demos into episode-complete systems. Among highest FID episodes to 2026 reality.",
    "nearest_real_systems": [
      "major social platforms",
      "attention economy regulation debates"
    ],
    "evidence_ids": [
      "s05e02-smithereens-full-fidelity-gap-ev1"
    ]
  }
]
