[
  {
    "thesis_id": "s03e04-san-junipero-consciousness-upload-afterlife",
    "as_of": "2026-07-09",
    "provenance": "deepresearch-agent",
    "axes": {
      "THESIS_POSS": {
        "value": 8.0,
        "ci_low": 2.0,
        "ci_high": 14.0,
        "tier": "L2"
      },
      "AI_EXEC": {
        "value": 25.0,
        "ci_low": 13.0,
        "ci_high": 37.0,
        "tier": "L2"
      },
      "TRL_comp": {
        "value": 12.0,
        "ci_low": 4.0,
        "ci_high": 20.0,
        "tier": "L2"
      },
      "SYS": {
        "value": 5.0,
        "ci_low": 0.0,
        "ci_high": 10.0,
        "tier": "L2"
      },
      "ECON": {
        "value": 15.0,
        "ci_low": 5.0,
        "ci_high": 25.0,
        "tier": "L1"
      },
      "SOC": {
        "value": 25.0,
        "ci_low": 10.0,
        "ci_high": 40.0,
        "tier": "L1"
      },
      "FID": {
        "value": 12.0,
        "ci_low": 4.0,
        "ci_high": 20.0,
        "tier": "L2"
      }
    },
    "contested": false,
    "contested_notes": "",
    "rationale_short": "Strong sci-fi gap. VR+grief aesthetic exists; scientific upload does not.",
    "nearest_real_systems": [
      "VR social worlds",
      "deathbots aesthetic",
      "not upload"
    ],
    "evidence_ids": [
      "s03e04-san-junipero-consciousness-upload-afterlife-ev1"
    ]
  },
  {
    "thesis_id": "s03e04-san-junipero-therapeutic-vr-nostalgia-world",
    "as_of": "2026-07-09",
    "provenance": "deepresearch-agent",
    "axes": {
      "THESIS_POSS": {
        "value": 70.0,
        "ci_low": 58.0,
        "ci_high": 82.0,
        "tier": "L2"
      },
      "AI_EXEC": {
        "value": 75.0,
        "ci_low": 65.0,
        "ci_high": 85.0,
        "tier": "L2"
      },
      "TRL_comp": {
        "value": 75.0,
        "ci_low": 65.0,
        "ci_high": 85.0,
        "tier": "L2"
      },
      "SYS": {
        "value": 55.0,
        "ci_low": 43.0,
        "ci_high": 67.0,
        "tier": "L1"
      },
      "ECON": {
        "value": 60.0,
        "ci_low": 48.0,
        "ci_high": 72.0,
        "tier": "L1"
      },
      "SOC": {
        "value": 70.0,
        "ci_low": 58.0,
        "ci_high": 82.0,
        "tier": "L1"
      },
      "FID": {
        "value": 40.0,
        "ci_low": 25.0,
        "ci_high": 55.0,
        "tier": "L1"
      }
    },
    "contested": false,
    "contested_notes": "",
    "rationale_short": "Partial deploy path without consciousness transfer claims.",
    "nearest_real_systems": [
      "VR elder care pilots",
      "reminiscence therapy + VR"
    ],
    "evidence_ids": [
      "s03e04-san-junipero-therapeutic-vr-nostalgia-world-ev1"
    ]
  },
  {
    "thesis_id": "s03e04-san-junipero-partial-real-world-analogue",
    "as_of": "2026-07-09",
    "provenance": "deepresearch-agent",
    "axes": {
      "THESIS_POSS": {
        "value": 9.2,
        "ci_low": 0.0,
        "ci_high": 19.2,
        "tier": "L1"
      },
      "AI_EXEC": {
        "value": 28.749999999999996,
        "ci_low": 12.749999999999996,
        "ci_high": 44.75,
        "tier": "L1"
      },
      "TRL_comp": {
        "value": 13.799999999999999,
        "ci_low": 1.799999999999999,
        "ci_high": 25.799999999999997,
        "tier": "L1"
      },
      "SYS": {
        "value": 5.75,
        "ci_low": 0.0,
        "ci_high": 14.75,
        "tier": "L1"
      },
      "ECON": {
        "value": 17.25,
        "ci_low": 3.25,
        "ci_high": 31.25,
        "tier": "L1"
      },
      "SOC": {
        "value": 28.749999999999996,
        "ci_low": 9.749999999999996,
        "ci_high": 47.75,
        "tier": "L1"
      },
      "FID": {
        "value": 13.799999999999999,
        "ci_low": 1.799999999999999,
        "ci_high": 25.799999999999997,
        "tier": "L1"
      }
    },
    "contested": false,
    "contested_notes": "",
    "rationale_short": "Partial-analogue card: scores emphasize systems that capture some mechanisms without claiming full episode outcome fidelity. Strong sci-fi gap. VR+grief aesthetic exists; scientific upload does not.",
    "nearest_real_systems": [
      "VR social worlds",
      "deathbots aesthetic",
      "not upload",
      "partial market analogues"
    ],
    "evidence_ids": [
      "s03e04-san-junipero-partial-real-world-analogue-ev1"
    ]
  }
]
