[
  {
    "thesis_id": "s06e01-joan-is-awful-life-as-streamed-ai-show",
    "as_of": "2026-07-09",
    "provenance": "deepresearch-agent",
    "axes": {
      "THESIS_POSS": {
        "value": 55.0,
        "ci_low": 40.0,
        "ci_high": 70.0,
        "tier": "L2"
      },
      "AI_EXEC": {
        "value": 75.0,
        "ci_low": 63.0,
        "ci_high": 87.0,
        "tier": "L2"
      },
      "TRL_comp": {
        "value": 70.0,
        "ci_low": 58.0,
        "ci_high": 82.0,
        "tier": "L2"
      },
      "SYS": {
        "value": 45.0,
        "ci_low": 30.0,
        "ci_high": 60.0,
        "tier": "L1"
      },
      "ECON": {
        "value": 60.0,
        "ci_low": 48.0,
        "ci_high": 72.0,
        "tier": "L1"
      },
      "SOC": {
        "value": 35.0,
        "ci_low": 20.0,
        "ci_high": 50.0,
        "tier": "L2"
      },
      "FID": {
        "value": 40.0,
        "ci_low": 25.0,
        "ci_high": 55.0,
        "tier": "L1"
      }
    },
    "contested": false,
    "contested_notes": "",
    "rationale_short": "Gen video rising fast; full automated personal-life prestige show with celebrity deepfakes is partial.",
    "nearest_real_systems": [
      "gen video 2025-26",
      "reality TV",
      "ToS data use",
      "not full personal show pipeline"
    ],
    "evidence_ids": [
      "s06e01-joan-is-awful-life-as-streamed-ai-show-ev1"
    ]
  },
  {
    "thesis_id": "s06e01-joan-is-awful-partial-real-world-analogue",
    "as_of": "2026-07-09",
    "provenance": "deepresearch-agent",
    "axes": {
      "THESIS_POSS": {
        "value": 63.24999999999999,
        "ci_low": 44.24999999999999,
        "ci_high": 82.25,
        "tier": "L1"
      },
      "AI_EXEC": {
        "value": 86.25,
        "ci_low": 70.25,
        "ci_high": 100.0,
        "tier": "L1"
      },
      "TRL_comp": {
        "value": 80.5,
        "ci_low": 64.5,
        "ci_high": 96.5,
        "tier": "L1"
      },
      "SYS": {
        "value": 51.74999999999999,
        "ci_low": 32.74999999999999,
        "ci_high": 70.75,
        "tier": "L1"
      },
      "ECON": {
        "value": 69.0,
        "ci_low": 53.0,
        "ci_high": 85.0,
        "tier": "L1"
      },
      "SOC": {
        "value": 40.25,
        "ci_low": 21.25,
        "ci_high": 59.25,
        "tier": "L1"
      },
      "FID": {
        "value": 46.0,
        "ci_low": 27.0,
        "ci_high": 65.0,
        "tier": "L1"
      }
    },
    "contested": false,
    "contested_notes": "",
    "rationale_short": "Partial-analogue card: scores emphasize systems that capture some mechanisms without claiming full episode outcome fidelity. Gen video rising fast; full automated personal-life prestige show with celebrity deepfakes is partial.",
    "nearest_real_systems": [
      "gen video 2025-26",
      "reality TV",
      "ToS data use",
      "not full personal show pipeline",
      "partial market analogues"
    ],
    "evidence_ids": [
      "s06e01-joan-is-awful-partial-real-world-analogue-ev1"
    ]
  },
  {
    "thesis_id": "s06e01-joan-is-awful-full-fidelity-gap",
    "as_of": "2026-07-09",
    "provenance": "deepresearch-agent",
    "axes": {
      "THESIS_POSS": {
        "value": 35.75,
        "ci_low": 16.75,
        "ci_high": 54.75,
        "tier": "L1"
      },
      "AI_EXEC": {
        "value": 48.75,
        "ci_low": 32.75,
        "ci_high": 64.75,
        "tier": "L1"
      },
      "TRL_comp": {
        "value": 45.5,
        "ci_low": 29.5,
        "ci_high": 61.5,
        "tier": "L1"
      },
      "SYS": {
        "value": 29.25,
        "ci_low": 10.25,
        "ci_high": 48.25,
        "tier": "L1"
      },
      "ECON": {
        "value": 39.0,
        "ci_low": 23.0,
        "ci_high": 55.0,
        "tier": "L1"
      },
      "SOC": {
        "value": 22.75,
        "ci_low": 3.75,
        "ci_high": 41.75,
        "tier": "L1"
      },
      "FID": {
        "value": 26.0,
        "ci_low": 7.0,
        "ci_high": 45.0,
        "tier": "L1"
      }
    },
    "contested": false,
    "contested_notes": "",
    "rationale_short": "Full-fidelity gap card: intentionally stricter than component readiness. Punishes collapsing gadget demos into episode-complete systems. Gen video rising fast; full automated personal-life prestige show with celebrity deepfakes is partial.",
    "nearest_real_systems": [
      "gen video 2025-26",
      "reality TV",
      "ToS data use",
      "not full personal show pipeline"
    ],
    "evidence_ids": [
      "s06e01-joan-is-awful-full-fidelity-gap-ev1"
    ]
  }
]
