[
  {
    "thesis_id": "s04e02-arkangel-parental-neural-surveillance-filter",
    "as_of": "2026-07-09",
    "provenance": "deepresearch-agent",
    "axes": {
      "THESIS_POSS": {
        "value": 35.0,
        "ci_low": 20.0,
        "ci_high": 50.0,
        "tier": "L2"
      },
      "AI_EXEC": {
        "value": 60.0,
        "ci_low": 48.0,
        "ci_high": 72.0,
        "tier": "L2"
      },
      "TRL_comp": {
        "value": 40.0,
        "ci_low": 28.0,
        "ci_high": 52.0,
        "tier": "L2"
      },
      "SYS": {
        "value": 25.0,
        "ci_low": 13.0,
        "ci_high": 37.0,
        "tier": "L1"
      },
      "ECON": {
        "value": 40.0,
        "ci_low": 25.0,
        "ci_high": 55.0,
        "tier": "L1"
      },
      "SOC": {
        "value": 30.0,
        "ci_low": 15.0,
        "ci_high": 45.0,
        "tier": "L2"
      },
      "FID": {
        "value": 40.0,
        "ci_low": 28.0,
        "ci_high": 52.0,
        "tier": "L2"
      }
    },
    "contested": false,
    "contested_notes": "",
    "rationale_short": "Software parental control high FID partial; neural implant version low SYS.",
    "nearest_real_systems": [
      "phone parental controls",
      "GPS kids watches",
      "content filters",
      "not neural implants"
    ],
    "evidence_ids": [
      "s04e02-arkangel-parental-neural-surveillance-filter-ev1"
    ]
  },
  {
    "thesis_id": "s04e02-arkangel-partial-real-world-analogue",
    "as_of": "2026-07-09",
    "provenance": "deepresearch-agent",
    "axes": {
      "THESIS_POSS": {
        "value": 40.25,
        "ci_low": 21.25,
        "ci_high": 59.25,
        "tier": "L1"
      },
      "AI_EXEC": {
        "value": 69.0,
        "ci_low": 53.0,
        "ci_high": 85.0,
        "tier": "L1"
      },
      "TRL_comp": {
        "value": 46.0,
        "ci_low": 30.0,
        "ci_high": 62.0,
        "tier": "L1"
      },
      "SYS": {
        "value": 28.749999999999996,
        "ci_low": 12.749999999999996,
        "ci_high": 44.75,
        "tier": "L1"
      },
      "ECON": {
        "value": 46.0,
        "ci_low": 27.0,
        "ci_high": 65.0,
        "tier": "L1"
      },
      "SOC": {
        "value": 34.5,
        "ci_low": 15.5,
        "ci_high": 53.5,
        "tier": "L1"
      },
      "FID": {
        "value": 46.0,
        "ci_low": 30.0,
        "ci_high": 62.0,
        "tier": "L1"
      }
    },
    "contested": false,
    "contested_notes": "",
    "rationale_short": "Partial-analogue card: scores emphasize systems that capture some mechanisms without claiming full episode outcome fidelity. Software parental control high FID partial; neural implant version low SYS.",
    "nearest_real_systems": [
      "phone parental controls",
      "GPS kids watches",
      "content filters",
      "not neural implants",
      "partial market analogues"
    ],
    "evidence_ids": [
      "s04e02-arkangel-partial-real-world-analogue-ev1"
    ]
  },
  {
    "thesis_id": "s04e02-arkangel-full-fidelity-gap",
    "as_of": "2026-07-09",
    "provenance": "deepresearch-agent",
    "axes": {
      "THESIS_POSS": {
        "value": 22.75,
        "ci_low": 3.75,
        "ci_high": 41.75,
        "tier": "L1"
      },
      "AI_EXEC": {
        "value": 39.0,
        "ci_low": 23.0,
        "ci_high": 55.0,
        "tier": "L1"
      },
      "TRL_comp": {
        "value": 26.0,
        "ci_low": 10.0,
        "ci_high": 42.0,
        "tier": "L1"
      },
      "SYS": {
        "value": 16.25,
        "ci_low": 0.25,
        "ci_high": 32.25,
        "tier": "L1"
      },
      "ECON": {
        "value": 26.0,
        "ci_low": 7.0,
        "ci_high": 45.0,
        "tier": "L1"
      },
      "SOC": {
        "value": 19.5,
        "ci_low": 0.5,
        "ci_high": 38.5,
        "tier": "L1"
      },
      "FID": {
        "value": 26.0,
        "ci_low": 10.0,
        "ci_high": 42.0,
        "tier": "L1"
      }
    },
    "contested": false,
    "contested_notes": "",
    "rationale_short": "Full-fidelity gap card: intentionally stricter than component readiness. Punishes collapsing gadget demos into episode-complete systems. Software parental control high FID partial; neural implant version low SYS.",
    "nearest_real_systems": [
      "phone parental controls",
      "GPS kids watches",
      "content filters",
      "not neural implants"
    ],
    "evidence_ids": [
      "s04e02-arkangel-full-fidelity-gap-ev1"
    ]
  }
]
