[
  {
    "thesis_id": "s03e01-nosedive-peer-rating-socioeconomic-gate",
    "as_of": "2026-07-09",
    "provenance": "deepresearch-agent",
    "axes": {
      "THESIS_POSS": {
        "value": 70.0,
        "ci_low": 58.0,
        "ci_high": 82.0,
        "tier": "L2"
      },
      "AI_EXEC": {
        "value": 75.0,
        "ci_low": 65.0,
        "ci_high": 85.0,
        "tier": "L2"
      },
      "TRL_comp": {
        "value": 85.0,
        "ci_low": 77.0,
        "ci_high": 93.0,
        "tier": "L3"
      },
      "SYS": {
        "value": 65.0,
        "ci_low": 53.0,
        "ci_high": 77.0,
        "tier": "L2"
      },
      "ECON": {
        "value": 75.0,
        "ci_low": 65.0,
        "ci_high": 85.0,
        "tier": "L2"
      },
      "SOC": {
        "value": 55.0,
        "ci_low": 40.0,
        "ci_high": 70.0,
        "tier": "CONTESTED"
      },
      "FID": {
        "value": 55.0,
        "ci_low": 43.0,
        "ci_high": 67.0,
        "tier": "L2"
      }
    },
    "contested": true,
    "contested_notes": "See axis tiers marked CONTESTED.",
    "rationale_short": "Partial deploy widely; universal implant pastel dystopia is oversold. Contested SOC across jurisdictions.",
    "nearest_real_systems": [
      "China social credit pilots (complex)",
      "platform reputation",
      "Sesame-like scores",
      "Uber ratings"
    ],
    "evidence_ids": [
      "s03e01-nosedive-peer-rating-socioeconomic-gate-ev1",
      "s03e01-nosedive-peer-rating-socioeconomic-gate-ev2"
    ]
  },
  {
    "thesis_id": "s03e01-nosedive-partial-real-world-analogue",
    "as_of": "2026-07-09",
    "provenance": "deepresearch-agent",
    "axes": {
      "THESIS_POSS": {
        "value": 80.5,
        "ci_low": 64.5,
        "ci_high": 96.5,
        "tier": "L1"
      },
      "AI_EXEC": {
        "value": 86.25,
        "ci_low": 72.25,
        "ci_high": 100.0,
        "tier": "L1"
      },
      "TRL_comp": {
        "value": 97.74999999999999,
        "ci_low": 85.74999999999999,
        "ci_high": 100.0,
        "tier": "L1"
      },
      "SYS": {
        "value": 74.75,
        "ci_low": 58.75,
        "ci_high": 90.75,
        "tier": "L1"
      },
      "ECON": {
        "value": 86.25,
        "ci_low": 72.25,
        "ci_high": 100.0,
        "tier": "L1"
      },
      "SOC": {
        "value": 63.24999999999999,
        "ci_low": 44.24999999999999,
        "ci_high": 82.25,
        "tier": "L1"
      },
      "FID": {
        "value": 63.24999999999999,
        "ci_low": 47.24999999999999,
        "ci_high": 79.25,
        "tier": "L1"
      }
    },
    "contested": false,
    "contested_notes": "",
    "rationale_short": "Partial-analogue card: scores emphasize systems that capture some mechanisms without claiming full episode outcome fidelity. Partial deploy widely; universal implant pastel dystopia is oversold. Contested SOC across jurisdictions.",
    "nearest_real_systems": [
      "China social credit pilots (complex)",
      "platform reputation",
      "Sesame-like scores",
      "Uber ratings",
      "partial market analogues"
    ],
    "evidence_ids": [
      "s03e01-nosedive-partial-real-world-analogue-ev1",
      "s03e01-nosedive-partial-real-world-analogue-ev2"
    ]
  },
  {
    "thesis_id": "s03e01-nosedive-full-fidelity-gap",
    "as_of": "2026-07-09",
    "provenance": "deepresearch-agent",
    "axes": {
      "THESIS_POSS": {
        "value": 45.5,
        "ci_low": 29.5,
        "ci_high": 61.5,
        "tier": "L1"
      },
      "AI_EXEC": {
        "value": 48.75,
        "ci_low": 34.75,
        "ci_high": 62.75,
        "tier": "L1"
      },
      "TRL_comp": {
        "value": 55.25,
        "ci_low": 43.25,
        "ci_high": 67.25,
        "tier": "L1"
      },
      "SYS": {
        "value": 42.25,
        "ci_low": 26.25,
        "ci_high": 58.25,
        "tier": "L1"
      },
      "ECON": {
        "value": 48.75,
        "ci_low": 34.75,
        "ci_high": 62.75,
        "tier": "L1"
      },
      "SOC": {
        "value": 35.75,
        "ci_low": 16.75,
        "ci_high": 54.75,
        "tier": "L1"
      },
      "FID": {
        "value": 35.75,
        "ci_low": 19.75,
        "ci_high": 51.75,
        "tier": "L1"
      }
    },
    "contested": false,
    "contested_notes": "",
    "rationale_short": "Full-fidelity gap card: intentionally stricter than component readiness. Punishes collapsing gadget demos into episode-complete systems. Partial deploy widely; universal implant pastel dystopia is oversold. Contested SOC across jurisdictions.",
    "nearest_real_systems": [
      "China social credit pilots (complex)",
      "platform reputation",
      "Sesame-like scores",
      "Uber ratings"
    ],
    "evidence_ids": [
      "s03e01-nosedive-full-fidelity-gap-ev1",
      "s03e01-nosedive-full-fidelity-gap-ev2"
    ]
  }
]
