[
  {
    "thesis_id": "s01e03-entire-history-of-you-continuous-memory-recording",
    "as_of": "2026-07-09",
    "provenance": "deepresearch-agent",
    "axes": {
      "THESIS_POSS": {
        "value": 40.0,
        "ci_low": 25.0,
        "ci_high": 55.0,
        "tier": "L2"
      },
      "AI_EXEC": {
        "value": 55.0,
        "ci_low": 43.0,
        "ci_high": 67.0,
        "tier": "L2"
      },
      "TRL_comp": {
        "value": 45.0,
        "ci_low": 33.0,
        "ci_high": 57.0,
        "tier": "L2"
      },
      "SYS": {
        "value": 30.0,
        "ci_low": 18.0,
        "ci_high": 42.0,
        "tier": "L2"
      },
      "ECON": {
        "value": 35.0,
        "ci_low": 20.0,
        "ci_high": 50.0,
        "tier": "L1"
      },
      "SOC": {
        "value": 25.0,
        "ci_low": 10.0,
        "ci_high": 40.0,
        "tier": "L2"
      },
      "FID": {
        "value": 35.0,
        "ci_low": 23.0,
        "ci_high": 47.0,
        "tier": "L2"
      }
    },
    "contested": false,
    "contested_notes": "",
    "rationale_short": "AI can index video well; continuous neural AV implant with seamless replay is not consumer. Wearables are partial FID.",
    "nearest_real_systems": [
      "bodycams",
      "smart glasses",
      "phone life-logging apps",
      "Neuralink motor BCIs"
    ],
    "evidence_ids": [
      "s01e03-entire-history-of-you-continuous-memory-recording-ev1",
      "s01e03-entire-history-of-you-continuous-memory-recording-ev2"
    ]
  },
  {
    "thesis_id": "s01e03-entire-history-of-you-memory-as-relationship-weapon",
    "as_of": "2026-07-09",
    "provenance": "deepresearch-agent",
    "axes": {
      "THESIS_POSS": {
        "value": 65.0,
        "ci_low": 53.0,
        "ci_high": 77.0,
        "tier": "L2"
      },
      "AI_EXEC": {
        "value": 70.0,
        "ci_low": 60.0,
        "ci_high": 80.0,
        "tier": "L2"
      },
      "TRL_comp": {
        "value": 75.0,
        "ci_low": 65.0,
        "ci_high": 85.0,
        "tier": "L2"
      },
      "SYS": {
        "value": 60.0,
        "ci_low": 48.0,
        "ci_high": 72.0,
        "tier": "L1"
      },
      "ECON": {
        "value": 70.0,
        "ci_low": 60.0,
        "ci_high": 80.0,
        "tier": "L1"
      },
      "SOC": {
        "value": 55.0,
        "ci_low": 40.0,
        "ci_high": 70.0,
        "tier": "L1"
      },
      "FID": {
        "value": 55.0,
        "ci_low": 43.0,
        "ci_high": 67.0,
        "tier": "L1"
      }
    },
    "contested": false,
    "contested_notes": "",
    "rationale_short": "Without implants, phone/cloud archives already weaponize memory; AI search increases accessibility.",
    "nearest_real_systems": [
      "phone gallery evidence in disputes",
      "cloud photo timelines",
      "smart home cams"
    ],
    "evidence_ids": [
      "s01e03-entire-history-of-you-memory-as-relationship-weapon-ev1"
    ]
  },
  {
    "thesis_id": "s01e03-entire-history-of-you-partial-real-world-analogue",
    "as_of": "2026-07-09",
    "provenance": "deepresearch-agent",
    "axes": {
      "THESIS_POSS": {
        "value": 46.0,
        "ci_low": 27.0,
        "ci_high": 65.0,
        "tier": "L1"
      },
      "AI_EXEC": {
        "value": 63.24999999999999,
        "ci_low": 47.24999999999999,
        "ci_high": 79.25,
        "tier": "L1"
      },
      "TRL_comp": {
        "value": 51.74999999999999,
        "ci_low": 35.74999999999999,
        "ci_high": 67.75,
        "tier": "L1"
      },
      "SYS": {
        "value": 34.5,
        "ci_low": 18.5,
        "ci_high": 50.5,
        "tier": "L1"
      },
      "ECON": {
        "value": 40.25,
        "ci_low": 21.25,
        "ci_high": 59.25,
        "tier": "L1"
      },
      "SOC": {
        "value": 28.749999999999996,
        "ci_low": 9.749999999999996,
        "ci_high": 47.75,
        "tier": "L1"
      },
      "FID": {
        "value": 40.25,
        "ci_low": 24.25,
        "ci_high": 56.25,
        "tier": "L1"
      }
    },
    "contested": false,
    "contested_notes": "",
    "rationale_short": "Partial-analogue card: scores emphasize systems that capture some mechanisms without claiming full episode outcome fidelity. AI can index video well; continuous neural AV implant with seamless replay is not consumer. Wearables are partial FID.",
    "nearest_real_systems": [
      "bodycams",
      "smart glasses",
      "phone life-logging apps",
      "Neuralink motor BCIs",
      "partial market analogues"
    ],
    "evidence_ids": [
      "s01e03-entire-history-of-you-partial-real-world-analogue-ev1",
      "s01e03-entire-history-of-you-partial-real-world-analogue-ev2"
    ]
  }
]
