[
  {
    "thesis_id": "s03e05-men-against-fire-military-hud-dehumanization",
    "as_of": "2026-07-09",
    "provenance": "deepresearch-agent",
    "axes": {
      "THESIS_POSS": {
        "value": 35.0,
        "ci_low": 20.0,
        "ci_high": 50.0,
        "tier": "L1"
      },
      "AI_EXEC": {
        "value": 50.0,
        "ci_low": 35.0,
        "ci_high": 65.0,
        "tier": "L2"
      },
      "TRL_comp": {
        "value": 45.0,
        "ci_low": 30.0,
        "ci_high": 60.0,
        "tier": "L1"
      },
      "SYS": {
        "value": 25.0,
        "ci_low": 13.0,
        "ci_high": 37.0,
        "tier": "L1"
      },
      "ECON": {
        "value": 40.0,
        "ci_low": 25.0,
        "ci_high": 55.0,
        "tier": "L1"
      },
      "SOC": {
        "value": 15.0,
        "ci_low": 5.0,
        "ci_high": 25.0,
        "tier": "L2"
      },
      "FID": {
        "value": 25.0,
        "ci_low": 13.0,
        "ci_high": 37.0,
        "tier": "L1"
      }
    },
    "contested": false,
    "contested_notes": "",
    "rationale_short": "CV/AR for soldiers advancing; full MASS-style reality rewrite is not confirmed fielded at episode fidelity.",
    "nearest_real_systems": [
      "military AR research",
      "target designation systems",
      "not full monster-filter implants"
    ],
    "evidence_ids": [
      "s03e05-men-against-fire-military-hud-dehumanization-ev1"
    ]
  },
  {
    "thesis_id": "s03e05-men-against-fire-partial-real-world-analogue",
    "as_of": "2026-07-09",
    "provenance": "deepresearch-agent",
    "axes": {
      "THESIS_POSS": {
        "value": 40.25,
        "ci_low": 21.25,
        "ci_high": 59.25,
        "tier": "L1"
      },
      "AI_EXEC": {
        "value": 57.49999999999999,
        "ci_low": 38.49999999999999,
        "ci_high": 76.5,
        "tier": "L1"
      },
      "TRL_comp": {
        "value": 51.74999999999999,
        "ci_low": 32.74999999999999,
        "ci_high": 70.75,
        "tier": "L1"
      },
      "SYS": {
        "value": 28.749999999999996,
        "ci_low": 12.749999999999996,
        "ci_high": 44.75,
        "tier": "L1"
      },
      "ECON": {
        "value": 46.0,
        "ci_low": 27.0,
        "ci_high": 65.0,
        "tier": "L1"
      },
      "SOC": {
        "value": 17.25,
        "ci_low": 3.25,
        "ci_high": 31.25,
        "tier": "L1"
      },
      "FID": {
        "value": 28.749999999999996,
        "ci_low": 12.749999999999996,
        "ci_high": 44.75,
        "tier": "L1"
      }
    },
    "contested": false,
    "contested_notes": "",
    "rationale_short": "Partial-analogue card: scores emphasize systems that capture some mechanisms without claiming full episode outcome fidelity. CV/AR for soldiers advancing; full MASS-style reality rewrite is not confirmed fielded at episode fidelity.",
    "nearest_real_systems": [
      "military AR research",
      "target designation systems",
      "not full monster-filter implants",
      "partial market analogues"
    ],
    "evidence_ids": [
      "s03e05-men-against-fire-partial-real-world-analogue-ev1"
    ]
  },
  {
    "thesis_id": "s03e05-men-against-fire-full-fidelity-gap",
    "as_of": "2026-07-09",
    "provenance": "deepresearch-agent",
    "axes": {
      "THESIS_POSS": {
        "value": 22.75,
        "ci_low": 3.75,
        "ci_high": 41.75,
        "tier": "L1"
      },
      "AI_EXEC": {
        "value": 32.5,
        "ci_low": 13.5,
        "ci_high": 51.5,
        "tier": "L1"
      },
      "TRL_comp": {
        "value": 29.25,
        "ci_low": 10.25,
        "ci_high": 48.25,
        "tier": "L1"
      },
      "SYS": {
        "value": 16.25,
        "ci_low": 0.25,
        "ci_high": 32.25,
        "tier": "L1"
      },
      "ECON": {
        "value": 26.0,
        "ci_low": 7.0,
        "ci_high": 45.0,
        "tier": "L1"
      },
      "SOC": {
        "value": 9.75,
        "ci_low": 0.0,
        "ci_high": 23.75,
        "tier": "L1"
      },
      "FID": {
        "value": 16.25,
        "ci_low": 0.25,
        "ci_high": 32.25,
        "tier": "L1"
      }
    },
    "contested": false,
    "contested_notes": "",
    "rationale_short": "Full-fidelity gap card: intentionally stricter than component readiness. Punishes collapsing gadget demos into episode-complete systems. CV/AR for soldiers advancing; full MASS-style reality rewrite is not confirmed fielded at episode fidelity.",
    "nearest_real_systems": [
      "military AR research",
      "target designation systems",
      "not full monster-filter implants"
    ],
    "evidence_ids": [
      "s03e05-men-against-fire-full-fidelity-gap-ev1"
    ]
  }
]
