[
  {
    "thesis_id": "special-white-christmas-cookie-mind-clone-assistant",
    "as_of": "2026-07-09",
    "provenance": "deepresearch-agent",
    "axes": {
      "THESIS_POSS": {
        "value": 15.0,
        "ci_low": 5.0,
        "ci_high": 25.0,
        "tier": "L2"
      },
      "AI_EXEC": {
        "value": 35.0,
        "ci_low": 23.0,
        "ci_high": 47.0,
        "tier": "L2"
      },
      "TRL_comp": {
        "value": 20.0,
        "ci_low": 10.0,
        "ci_high": 30.0,
        "tier": "L2"
      },
      "SYS": {
        "value": 10.0,
        "ci_low": 2.0,
        "ci_high": 18.0,
        "tier": "L2"
      },
      "ECON": {
        "value": 20.0,
        "ci_low": 8.0,
        "ci_high": 32.0,
        "tier": "L1"
      },
      "SOC": {
        "value": 15.0,
        "ci_low": 5.0,
        "ci_high": 25.0,
        "tier": "L1"
      },
      "FID": {
        "value": 20.0,
        "ci_low": 10.0,
        "ci_high": 30.0,
        "tier": "L2"
      }
    },
    "contested": false,
    "contested_notes": "",
    "rationale_short": "Honest sci-fi gap: behavioral mimic \u2260 phenomenal cookie. Time dilation of subjective experience is not engineering-ready.",
    "nearest_real_systems": [
      "LLM personal assistants",
      "griefbots",
      "not conscious clones"
    ],
    "evidence_ids": [
      "special-white-christmas-cookie-mind-clone-assistant-ev1",
      "special-white-christmas-cookie-mind-clone-assistant-ev2"
    ]
  },
  {
    "thesis_id": "special-white-christmas-real-world-block-z-eyes",
    "as_of": "2026-07-09",
    "provenance": "deepresearch-agent",
    "axes": {
      "THESIS_POSS": {
        "value": 35.0,
        "ci_low": 20.0,
        "ci_high": 50.0,
        "tier": "L2"
      },
      "AI_EXEC": {
        "value": 55.0,
        "ci_low": 43.0,
        "ci_high": 67.0,
        "tier": "L2"
      },
      "TRL_comp": {
        "value": 50.0,
        "ci_low": 38.0,
        "ci_high": 62.0,
        "tier": "L2"
      },
      "SYS": {
        "value": 25.0,
        "ci_low": 13.0,
        "ci_high": 37.0,
        "tier": "L1"
      },
      "ECON": {
        "value": 40.0,
        "ci_low": 25.0,
        "ci_high": 55.0,
        "tier": "L1"
      },
      "SOC": {
        "value": 30.0,
        "ci_low": 15.0,
        "ci_high": 45.0,
        "tier": "L1"
      },
      "FID": {
        "value": 25.0,
        "ci_low": 13.0,
        "ci_high": 37.0,
        "tier": "L1"
      }
    },
    "contested": false,
    "contested_notes": "",
    "rationale_short": "CV can segment people; mandatory implant society with perfect IRL block is not deployed.",
    "nearest_real_systems": [
      "AR glasses demos",
      "social media block (digital only)",
      "CV person tracking"
    ],
    "evidence_ids": [
      "special-white-christmas-real-world-block-z-eyes-ev1"
    ]
  },
  {
    "thesis_id": "special-white-christmas-cookie-confession-interrogation",
    "as_of": "2026-07-09",
    "provenance": "deepresearch-agent",
    "axes": {
      "THESIS_POSS": {
        "value": 18.0,
        "ci_low": 8.0,
        "ci_high": 28.0,
        "tier": "L1"
      },
      "AI_EXEC": {
        "value": 40.0,
        "ci_low": 25.0,
        "ci_high": 55.0,
        "tier": "L1"
      },
      "TRL_comp": {
        "value": 22.0,
        "ci_low": 10.0,
        "ci_high": 34.0,
        "tier": "L1"
      },
      "SYS": {
        "value": 12.0,
        "ci_low": 4.0,
        "ci_high": 20.0,
        "tier": "L1"
      },
      "ECON": {
        "value": 25.0,
        "ci_low": 13.0,
        "ci_high": 37.0,
        "tier": "L1"
      },
      "SOC": {
        "value": 12.0,
        "ci_low": 4.0,
        "ci_high": 20.0,
        "tier": "L2"
      },
      "FID": {
        "value": 15.0,
        "ci_low": 5.0,
        "ci_high": 25.0,
        "tier": "L1"
      }
    },
    "contested": false,
    "contested_notes": "",
    "rationale_short": "Legally and scientifically far; LLM confessions of fictional personas are not legal mind copies.",
    "nearest_real_systems": [
      "chatbot interrogation research (limited)",
      "not legal cookie confessions"
    ],
    "evidence_ids": [
      "special-white-christmas-cookie-confession-interrogation-ev1"
    ]
  }
]
