[
  {
    "thesis_id": "s07e04-plaything-evolving-artificial-lifeforms",
    "as_of": "2026-07-09",
    "provenance": "deepresearch-agent",
    "axes": {
      "THESIS_POSS": {
        "value": 35.0,
        "ci_low": 20.0,
        "ci_high": 50.0,
        "tier": "L1"
      },
      "AI_EXEC": {
        "value": 45.0,
        "ci_low": 30.0,
        "ci_high": 60.0,
        "tier": "L2"
      },
      "TRL_comp": {
        "value": 40.0,
        "ci_low": 25.0,
        "ci_high": 55.0,
        "tier": "L1"
      },
      "SYS": {
        "value": 25.0,
        "ci_low": 13.0,
        "ci_high": 37.0,
        "tier": "L1"
      },
      "ECON": {
        "value": 40.0,
        "ci_low": 25.0,
        "ci_high": 55.0,
        "tier": "L1"
      },
      "SOC": {
        "value": 40.0,
        "ci_low": 25.0,
        "ci_high": 55.0,
        "tier": "L1"
      },
      "FID": {
        "value": 25.0,
        "ci_low": 13.0,
        "ci_high": 37.0,
        "tier": "L1"
      }
    },
    "contested": false,
    "contested_notes": "",
    "rationale_short": "Research ALife exists; episode-level evolving organisms with murder-plot stakes are not demonstrated.",
    "nearest_real_systems": [
      "ALife research",
      "open-ended RL",
      "not thrivable digital organisms at episode scale"
    ],
    "evidence_ids": [
      "s07e04-plaything-evolving-artificial-lifeforms-ev1"
    ]
  },
  {
    "thesis_id": "s07e04-plaything-partial-real-world-analogue",
    "as_of": "2026-07-09",
    "provenance": "deepresearch-agent",
    "axes": {
      "THESIS_POSS": {
        "value": 40.25,
        "ci_low": 21.25,
        "ci_high": 59.25,
        "tier": "L1"
      },
      "AI_EXEC": {
        "value": 51.74999999999999,
        "ci_low": 32.74999999999999,
        "ci_high": 70.75,
        "tier": "L1"
      },
      "TRL_comp": {
        "value": 46.0,
        "ci_low": 27.0,
        "ci_high": 65.0,
        "tier": "L1"
      },
      "SYS": {
        "value": 28.749999999999996,
        "ci_low": 12.749999999999996,
        "ci_high": 44.75,
        "tier": "L1"
      },
      "ECON": {
        "value": 46.0,
        "ci_low": 27.0,
        "ci_high": 65.0,
        "tier": "L1"
      },
      "SOC": {
        "value": 46.0,
        "ci_low": 27.0,
        "ci_high": 65.0,
        "tier": "L1"
      },
      "FID": {
        "value": 28.749999999999996,
        "ci_low": 12.749999999999996,
        "ci_high": 44.75,
        "tier": "L1"
      }
    },
    "contested": false,
    "contested_notes": "",
    "rationale_short": "Partial-analogue card: scores emphasize systems that capture some mechanisms without claiming full episode outcome fidelity. Research ALife exists; episode-level evolving organisms with murder-plot stakes are not demonstrated.",
    "nearest_real_systems": [
      "ALife research",
      "open-ended RL",
      "not thrivable digital organisms at episode scale",
      "partial market analogues"
    ],
    "evidence_ids": [
      "s07e04-plaything-partial-real-world-analogue-ev1"
    ]
  },
  {
    "thesis_id": "s07e04-plaything-full-fidelity-gap",
    "as_of": "2026-07-09",
    "provenance": "deepresearch-agent",
    "axes": {
      "THESIS_POSS": {
        "value": 22.75,
        "ci_low": 3.75,
        "ci_high": 41.75,
        "tier": "L1"
      },
      "AI_EXEC": {
        "value": 29.25,
        "ci_low": 10.25,
        "ci_high": 48.25,
        "tier": "L1"
      },
      "TRL_comp": {
        "value": 26.0,
        "ci_low": 7.0,
        "ci_high": 45.0,
        "tier": "L1"
      },
      "SYS": {
        "value": 16.25,
        "ci_low": 0.25,
        "ci_high": 32.25,
        "tier": "L1"
      },
      "ECON": {
        "value": 26.0,
        "ci_low": 7.0,
        "ci_high": 45.0,
        "tier": "L1"
      },
      "SOC": {
        "value": 26.0,
        "ci_low": 7.0,
        "ci_high": 45.0,
        "tier": "L1"
      },
      "FID": {
        "value": 16.25,
        "ci_low": 0.25,
        "ci_high": 32.25,
        "tier": "L1"
      }
    },
    "contested": false,
    "contested_notes": "",
    "rationale_short": "Full-fidelity gap card: intentionally stricter than component readiness. Punishes collapsing gadget demos into episode-complete systems. Research ALife exists; episode-level evolving organisms with murder-plot stakes are not demonstrated.",
    "nearest_real_systems": [
      "ALife research",
      "open-ended RL",
      "not thrivable digital organisms at episode scale"
    ],
    "evidence_ids": [
      "s07e04-plaything-full-fidelity-gap-ev1"
    ]
  }
]
