[
  {
    "thesis_id": "s01e02-fifteen-million-merits-attention-economy-gamified-labor",
    "as_of": "2026-07-09",
    "provenance": "deepresearch-agent",
    "axes": {
      "THESIS_POSS": {
        "value": 80.0,
        "ci_low": 70.0,
        "ci_high": 90.0,
        "tier": "L2"
      },
      "AI_EXEC": {
        "value": 85.0,
        "ci_low": 77.0,
        "ci_high": 93.0,
        "tier": "L2"
      },
      "TRL_comp": {
        "value": 90.0,
        "ci_low": 85.0,
        "ci_high": 95.0,
        "tier": "L3"
      },
      "SYS": {
        "value": 85.0,
        "ci_low": 77.0,
        "ci_high": 93.0,
        "tier": "L2"
      },
      "ECON": {
        "value": 88.0,
        "ci_low": 80.0,
        "ci_high": 96.0,
        "tier": "L2"
      },
      "SOC": {
        "value": 75.0,
        "ci_low": 65.0,
        "ci_high": 85.0,
        "tier": "L2"
      },
      "FID": {
        "value": 70.0,
        "ci_low": 58.0,
        "ci_high": 82.0,
        "tier": "L2"
      }
    },
    "contested": false,
    "contested_notes": "",
    "rationale_short": "Core loop is largely deployed; episode aesthetics (bike farms, wall screens) are stylized but mechanism is present.",
    "nearest_real_systems": [
      "TikTok/YouTube creator economy",
      "gig apps",
      "in-game currencies",
      "attention-economy critiques"
    ],
    "evidence_ids": [
      "s01e02-fifteen-million-merits-attention-economy-gamified-labor-ev1"
    ]
  },
  {
    "thesis_id": "s01e02-fifteen-million-merits-coopted-dissent-as-content",
    "as_of": "2026-07-09",
    "provenance": "deepresearch-agent",
    "axes": {
      "THESIS_POSS": {
        "value": 75.0,
        "ci_low": 63.0,
        "ci_high": 87.0,
        "tier": "L1"
      },
      "AI_EXEC": {
        "value": 70.0,
        "ci_low": 58.0,
        "ci_high": 82.0,
        "tier": "L1"
      },
      "TRL_comp": {
        "value": 85.0,
        "ci_low": 77.0,
        "ci_high": 93.0,
        "tier": "L2"
      },
      "SYS": {
        "value": 72.0,
        "ci_low": 60.0,
        "ci_high": 84.0,
        "tier": "L1"
      },
      "ECON": {
        "value": 80.0,
        "ci_low": 70.0,
        "ci_high": 90.0,
        "tier": "L1"
      },
      "SOC": {
        "value": 70.0,
        "ci_low": 58.0,
        "ci_high": 82.0,
        "tier": "L1"
      },
      "FID": {
        "value": 68.0,
        "ci_low": 56.0,
        "ci_high": 80.0,
        "tier": "L1"
      }
    },
    "contested": false,
    "contested_notes": "",
    "rationale_short": "Media co-option of dissent is historical; algorithmic amplification accelerates it.",
    "nearest_real_systems": [
      "outrage media cycles",
      "platform-native political entertainment"
    ],
    "evidence_ids": [
      "s01e02-fifteen-million-merits-coopted-dissent-as-content-ev1"
    ]
  },
  {
    "thesis_id": "s01e02-fifteen-million-merits-partial-real-world-analogue",
    "as_of": "2026-07-09",
    "provenance": "deepresearch-agent",
    "axes": {
      "THESIS_POSS": {
        "value": 92.0,
        "ci_low": 78.0,
        "ci_high": 100.0,
        "tier": "L1"
      },
      "AI_EXEC": {
        "value": 97.74999999999999,
        "ci_low": 85.74999999999999,
        "ci_high": 100.0,
        "tier": "L1"
      },
      "TRL_comp": {
        "value": 100.0,
        "ci_low": 91.0,
        "ci_high": 100.0,
        "tier": "L1"
      },
      "SYS": {
        "value": 97.74999999999999,
        "ci_low": 85.74999999999999,
        "ci_high": 100.0,
        "tier": "L1"
      },
      "ECON": {
        "value": 100.0,
        "ci_low": 88.0,
        "ci_high": 100.0,
        "tier": "L1"
      },
      "SOC": {
        "value": 86.25,
        "ci_low": 72.25,
        "ci_high": 100.0,
        "tier": "L1"
      },
      "FID": {
        "value": 80.5,
        "ci_low": 64.5,
        "ci_high": 96.5,
        "tier": "L1"
      }
    },
    "contested": false,
    "contested_notes": "",
    "rationale_short": "Partial-analogue card: scores emphasize systems that capture some mechanisms without claiming full episode outcome fidelity. Core loop is largely deployed; episode aesthetics (bike farms, wall screens) are stylized but mechanism is present.",
    "nearest_real_systems": [
      "TikTok/YouTube creator economy",
      "gig apps",
      "in-game currencies",
      "attention-economy critiques",
      "partial market analogues"
    ],
    "evidence_ids": [
      "s01e02-fifteen-million-merits-partial-real-world-analogue-ev1"
    ]
  }
]
